Table,Field,Type,Description
LabSheetDetails,TCFirst,Double (min=-10) (max=40),Première température de control
LabSheetDetails,TCAverage,Double (min=-10) (max=40),Moyenne de température de control
LabSheetDetails,ControlLot,String (max=100),Lot de contrôle
LabSheetDetails,Positive35,String (min=1) (max=1),Positive 35 (°C)
LabSheetDetails,NonTarget35,String (min=1) (max=1),Non target 35 (°C)
LabSheetDetails,Negative35,String (min=1) (max=1),Negative 35 (°C)
LabSheetDetails,Bath1Positive44_5,String (min=1) (max=1),Bath 1 positive 44.5 (°C)
LabSheetDetails,Bath2Positive44_5,String (min=1) (max=1),Bath 2 positive 44.5 (°C)
LabSheetDetails,Bath3Positive44_5,String (min=1) (max=1),Bath 3 positive 44.5 (°C)
LabSheetDetails,Bath1NonTarget44_5,String (min=1) (max=1),Bath 1 non target 44.5 (°C)
LabSheetDetails,Bath2NonTarget44_5,String (min=1) (max=1),Bath 2 non target 44.5 (°C)
LabSheetDetails,Bath3NonTarget44_5,String (min=1) (max=1),Bath 3 non target 44.5 (°C)
LabSheetDetails,Bath1Negative44_5,String (min=1) (max=1),Bath 1 negative 44.5 (°C)
LabSheetDetails,Bath2Negative44_5,String (min=1) (max=1),Bath 2 negative 44.5 (°C)
LabSheetDetails,Bath3Negative44_5,String (min=1) (max=1),Bath 3 negative 44.5 (°C)
LabSheetDetails,Blank35,String (min=1) (max=1),Blank 35 (°C)
LabSheetDetails,Bath1Blank44_5,String (min=1) (max=1),Bath 1 blank 44.5 (°C)
LabSheetDetails,Bath2Blank44_5,String (min=1) (max=1),Bath 2 blank 44.5 (°C)
LabSheetDetails,Bath3Blank44_5,String (min=1) (max=1),Bath 3 blank 44.5 (°C)
LabSheetDetails,Lot35,String (max=20),Lot 35 (°C)
LabSheetDetails,Lot44_5,String (max=20),Lot 44.5 (°C)
LabSheetDetails,Weather,String (max=250),Météo
LabSheetDetails,RunComment,String (max=250),Commentaire de tourée
LabSheetDetails,RunWeatherComment,String (max=250),Commentaire de tourée météo
LabSheetDetails,SampleBottleLotNumber,String (max=20),Numéro de lot des bouteille d'échantillonnage
LabSheetDetails,SalinitiesReadBy,String (max=20),Salinité lu par
LabSheetDetails,SalinitiesReadDate,DateTime,Date de lecture de salinité
LabSheetDetails,ResultsReadBy,String (max=20),Résultats lu par
LabSheetDetails,ResultsReadDate,DateTime,Date de lecture des résultats
LabSheetDetails,ResultsRecordedBy,String (max=20),Résultats enregistrés par
LabSheetDetails,ResultsRecordedDate,DateTime,Date de d'enregistrement des résultats
LabSheetDetails,DailyDuplicateRLog,Double (min=0) (max=100),R Log du duplicata du la tournée
LabSheetDetails,DailyDuplicatePrecisionCriteria,Double (min=0) (max=100),Critère de précision du duplicata du la tournée
LabSheetDetails,DailyDuplicateAcceptable,Boolean,Duplicata du la tournée est acceptable
LabSheetDetails,IntertechDuplicateRLog,Double (min=0) (max=100),R Log du duplicata intertech
LabSheetDetails,IntertechDuplicatePrecisionCriteria,Double (min=0) (max=100),Critère de précision du duplicata intertech
LabSheetDetails,IntertechDuplicateAcceptable,Boolean,Duplicata intertech est acceptable
LabSheetDetails,IntertechReadAcceptable,Boolean,Lecture intertech est acceptable
LabSheetDetails,LastUpdateDate_UTC,DateTime,Contient la date de la dernière mise à jour en (UTC)
LabSheetDetails,LastUpdateContactTVItemID,Int32,Contact TVItemID qui a fait le dernier changement
LabSheetTubeMPNDetails,,,La table LabSheetTubeMPNDetails contient des champs pour contenir les informations sur les tubes de laboratoire.
LabSheetTubeMPNDetails,LabSheetTubeMPNDetailID,Int32 (key),Contient l'identifiant unique sur chaque ligne de la table LabSheetTubeMPNDetails
LabSheetTubeMPNDetails,DBCommand,DBCommandEnum (int),Identifie la command de base de données pour syncroniser avec la base de données local
LabSheetTubeMPNDetails,LabSheetDetailID,Int32,Lien à la table LabSheetDetails représentant les détail de laboratoire
LabSheetTubeMPNDetails,Ordinal,Int32 (min=0) (max=1000),Ordre
LabSheetTubeMPNDetails,MWQMSiteTVItemID,Int32,Lien à la table TVItems représentant le site de MWQM (fr)
LabSheetTubeMPNDetails,SampleDateTime,DateTime,Date de la tournée
LabSheetTubeMPNDetails,MPN,Int32 (min=1) (max=10000000),Nombre le plus probable de colonies de coliform fécaux par 100 mL
LabSheetTubeMPNDetails,Tube10,Int32 (min=0) (max=5),Nombre de tube positif pour Tube 10
LabSheetTubeMPNDetails,Tube1_0,Int32 (min=0) (max=5),Nombre de tube positif pour Tube 1
LabSheetTubeMPNDetails,Tube0_1,Int32 (min=0) (max=5),Nombre de tube positif pour Tube .1
LabSheetTubeMPNDetails,Salinity,Double (min=0) (max=40),Salinité en parties par millier
LabSheetTubeMPNDetails,Temperature,Double (min=-10) (max=40),Température en dégré Celcius
LabSheetTubeMPNDetails,ProcessedBy,String (max=10),Traité par
LabSheetTubeMPNDetails,SampleType,SampleTypeEnum (int),Type d'échantillon
LabSheetTubeMPNDetails,SiteComment,String (max=250),Commentaire relié au site
LabSheetTubeMPNDetails,LastUpdateDate_UTC,DateTime,Contient la date de la dernière mise à jour en (UTC)
LabSheetTubeMPNDetails,LastUpdateContactTVItemID,Int32,Contact TVItemID qui a fait le dernier changement
Logs,,,La table Logs est utilisée pour conserver un historique des commandes des utilisateurs vers la base de données.
Logs,LogID,Int32 (key),Contient l'identifiant unique sur chaque ligne de la table Logs
Logs,DBCommand,DBCommandEnum (int),Identifie la command de base de données pour syncroniser avec la base de données local
Logs,TableName,String (max=50),Nom de la table
Logs,ID,Int32 (min=1),Clef de la table
Logs,LogCommand,LogCommandEnum (int),Command log
Logs,Information,String,Information décrivant la command log
Logs,LastUpdateDate_UTC,DateTime,Contient la date de la dernière mise à jour en (UTC)
Logs,LastUpdateContactTVItemID,Int32,Contact TVItemID qui a fait le dernier changement
MapInfos,,,La table MapInfos contient des champs pour contenir les informations relatives au mappage pour tous les objets de la base de données.
MapInfos,MapInfoID,Int32 (key),Contient l'identifiant unique sur chaque ligne de la table MapInfos
MapInfos,DBCommand,DBCommandEnum (int),Identifie la command de base de données pour syncroniser avec la base de données local
MapInfos,TVItemID,Int32,Lien à la table TVItems représentant l'item
MapInfos,TVType,TVTypeEnum (int),Type de l'arbre visuel
MapInfos,LatMin,Double (min=-90) (max=90),Latitude minimum
MapInfos,LatMax,Double (min=-90) (max=90),Latitude maximum
MapInfos,LngMin,Double (min=-180) (max=180),Longitude minimum
MapInfos,LngMax,Double (min=-180) (max=180),Longitude maximum
MapInfos,MapInfoDrawType,MapInfoDrawTypeEnum (int),Type d'object pour carte
MapInfos,LastUpdateDate_UTC,DateTime,Contient la date de la dernière mise à jour en (UTC)
MapInfos,LastUpdateContactTVItemID,Int32,Contact TVItemID qui a fait le dernier changement
MapInfoPoints,,,La table MapInfoPoints contient des champs pour contenir les informations relatives aux coordonnées de mappage.
MapInfoPoints,MapInfoPointID,Int32 (key),Contient l'identifiant unique sur chaque ligne de la table MapInfoPoints
MapInfoPoints,DBCommand,DBCommandEnum (int),Identifie la command de base de données pour syncroniser avec la base de données local
MapInfoPoints,MapInfoID,Int32,Lien à la table MapInfos représentant l'information de carte
MapInfoPoints,Ordinal,Int32 (min=0),Ordre
MapInfoPoints,Lat,Double (min=-90) (max=90),Latitude
MapInfoPoints,Lng,Double (min=-180) (max=180),Longitude
MapInfoPoints,LastUpdateDate_UTC,DateTime,Contient la date de la dernière mise à jour en (UTC)
MapInfoPoints,LastUpdateContactTVItemID,Int32,Contact TVItemID qui a fait le dernier changement
MikeBoundaryConditions,,,La table MikeBoundaryConditions contient des champs pour contenir les informations relatives aux conditions aux limites MIKE.
MikeBoundaryConditions,MikeBoundaryConditionID,Int32 (key),Contient l'identifiant unique sur chaque ligne de la table MikeBoundaryConditions
MikeBoundaryConditions,DBCommand,DBCommandEnum (int),Identifie la command de base de données pour syncroniser avec la base de données local
MikeBoundaryConditions,MikeBoundaryConditionTVItemID,Int32,Lien à la table TVItems représentant les conditions limits MIKE
MikeBoundaryConditions,MikeBoundaryConditionCode,String (max=100),Code de conditions limits MIKE
MikeBoundaryConditions,MikeBoundaryConditionName,String (max=100),Nom de conditions limits MIKE
MikeBoundaryConditions,MikeBoundaryConditionLength_m,Double (min=1) (max=100000),Longueur de conditions limits MIKE en mètres
MikeBoundaryConditions,MikeBoundaryConditionFormat,String (max=100),Format de conditions limits MIKE
MikeBoundaryConditions,MikeBoundaryConditionLevelOrVelocity,MikeBoundaryConditionLevelOrVelocityEnum (int),Niveau ou vélocité de conditions limits MIKE
MikeBoundaryConditions,WebTideDataSet,WebTideDataSetEnum (int),Donnée web tide
MikeBoundaryConditions,NumberOfWebTideNodes,Int32 (min=0) (max=1000),Nombre de noeux de web tide
MikeBoundaryConditions,WebTideDataFromStartToEndDate,String,Données web tide entre les dates
MikeBoundaryConditions,TVType,TVTypeEnum (int),Type d'arbre visuel
MikeBoundaryConditions,LastUpdateDate_UTC,DateTime,Contient la date de la dernière mise à jour en (UTC)
MikeBoundaryConditions,LastUpdateContactTVItemID,Int32,Contact TVItemID qui a fait le dernier changement
MikeScenarios,,,La table MikeScenarios contient des champs permettant de conserver et de gérer les scénarios MIKE.
MikeScenarios,MikeScenarioID,Int32 (key),Contient l'identifiant unique sur chaque ligne de la table MikeScenarios
MikeScenarios,DBCommand,DBCommandEnum (int),Identifie la command de base de données pour syncroniser avec la base de données local
MikeScenarios,MikeScenarioTVItemID,Int32,Lien à la table TVItems représentant le scénario MIKE
MikeScenarios,ParentMikeScenarioID,Int32,Lien à la table MIkeScenarios représentant le scénario MIKE
MikeScenarios,ScenarioStatus,ScenarioStatusEnum (int),État du scenario MIKE
MikeScenarios,ErrorInfo,String,Information de l'erreur du scenario MIKE
MikeScenarios,MikeScenarioStartDateTime_Local,DateTime,Date de départ du scenario MIKE en temps local
MikeScenarios,MikeScenarioEndDateTime_Local,DateTime,Date de fin du scenario MIKE en temps local
MikeScenarios,MikeScenarioStartExecutionDateTime_Local,DateTime,Début du temps d'exécution du scenario MIKE (local)
MikeScenarios,MikeScenarioExecutionTime_min,Double (min=1) (max=100000),Temps d'exécution du scenario MIKE en minutes
MikeScenarios,WindSpeed_km_h,Double (min=0) (max=100),Vitesse du vent en kilomètres par heure
MikeScenarios,WindDirection_deg,Double (min=0) (max=360),Direction du vent en degree (nord 0, est 90)
MikeScenarios,DecayFactor_per_day,Double (min=0) (max=100),Taux de décroissance par jour
MikeScenarios,DecayIsConstant,Boolean,Taux de décroissance est constant
MikeScenarios,DecayFactorAmplitude,Double (min=0) (max=100),Amplitude du taux de décroissance
MikeScenarios,ResultFrequency_min,Int32 (min=0) (max=100),Fréquence des résultats en minutes
MikeScenarios,AmbientTemperature_C,Double (min=-10) (max=40),Température ambiante en dégré Celcius
MikeScenarios,AmbientSalinity_PSU,Double (min=0) (max=40),Salinité ambiante en PSU (fr)
MikeScenarios,GenerateDecouplingFiles,Boolean,Générer des fichiers de découplage
MikeScenarios,UseDecouplingFiles,Boolean,Utiliser les fichiers de découplage
MikeScenarios,UseSalinityAndTemperatureInitialConditionFromTVFileTVItemID,Int32,Lien à la table TVItems représentant TV file
MikeScenarios,ForSimulatingMWQMRunTVItemID,Int32,Lien à la table TVItems représentant la trounée
MikeScenarios,ManningNumber,Double (min=0) (max=100),Nombre manning
MikeScenarios,NumberOfElements,Int32 (min=1) (max=1000000),Nombre d'éléments
MikeScenarios,NumberOfTimeSteps,Int32 (min=1) (max=1000000),Nombre de pas de temps
MikeScenarios,NumberOfSigmaLayers,Int32 (min=0) (max=100),Nombre de tranche sigma
MikeScenarios,NumberOfZLayers,Int32 (min=0) (max=100),Nombre de tranche Z
MikeScenarios,NumberOfHydroOutputParameters,Int32 (min=0) (max=100),Nombre de paramètres de sorti hydrodynamique
MikeScenarios,NumberOfTransOutputParameters,Int32 (min=0) (max=100),Nombre de paramètres de sorti transport
MikeScenarios,EstimatedHydroFileSize,Int64 (min=0) (max=100000000),Estimation de la taille du fichier hydrodynamique
MikeScenarios,EstimatedTransFileSize,Int64 (min=0) (max=100000000),Estimation de la taille du fichier transport
MikeScenarios,LastUpdateDate_UTC,DateTime,Contient la date de la dernière mise à jour en (UTC)
MikeScenarios,LastUpdateContactTVItemID,Int32,Contact TVItemID qui a fait le dernier changement
MikeScenarioResults,,,La table MikeScenarioResults contient des champs pour contenir une partie des résultats du scénario MIKE. Utilisation limitée pour le moment. Je ne sais pas si ce tableau sera conservé à l’avenir. Actuellement, tous les résultats des scénarios MIKE sont stockés dans des fichiers.
MikeScenarioResults,MikeScenarioResultID,Int32 (key),Contient l'identifiant unique sur chaque ligne de la table MikeScenarioResults
MikeScenarioResults,DBCommand,DBCommandEnum (int),Identifie la command de base de données pour syncroniser avec la base de données local
MikeScenarioResults,MikeScenarioTVItemID,Int32,Lien à la table TVItems représentant le scénario MIKE
MikeScenarioResults,MikeResultsJSON,String,Résultats du scenario MIKE en format JSON
MikeScenarioResults,LastUpdateDate_UTC,DateTime,Contient la date de la dernière mise à jour en (UTC)
MikeScenarioResults,LastUpdateContactTVItemID,Int32,Contact TVItemID qui a fait le dernier changement
MikeSources,,,La table MikeSources contient des champs pour conserver et gérer les sources MIKE qui peuvent être des rivières, des ruisseaux, des ruisseaux ou d'autres sources de pollution.
MikeSources,MikeSourceID,Int32 (key),Contient l'identifiant unique sur chaque ligne de la table MikeSources
MikeSources,DBCommand,DBCommandEnum (int),Identifie la command de base de données pour syncroniser avec la base de données local
MikeSources,MikeSourceTVItemID,Int32,Lien à la table TVItems représentant une source MIKE
MikeSources,IsContinuous,Boolean,La source est continue
MikeSources,Include,Boolean,La source est incluse
MikeSources,IsRiver,Boolean,La source est une rivière
MikeSources,UseHydrometric,Boolean,La source devrait usiliser un site hydrométrique avec facteur comme débits
MikeSources,HydrometricTVItemID,Int32,Lien à la table TVItems représentant un site hydrométrique
MikeSources,DrainageArea_km2,Double (min=0) (max=1000000),Bassin versant en kilomètres carrés
MikeSources,Factor,Double (min=0) (max=1000000),Facteur
MikeSources,SourceNumberString,String (max=50),Nombre de source
MikeSources,LastUpdateDate_UTC,DateTime,Contient la date de la dernière mise à jour en (UTC)
MikeSources,LastUpdateContactTVItemID,Int32,Contact TVItemID qui a fait le dernier changement
MikeSourceStartEnds,,,La table MikeSourceStartEnds contient des champs pour les déversements non continus.
MikeSourceStartEnds,MikeSourceStartEndID,Int32 (key),Contient l'identifiant unique sur chaque ligne de la table MikeSourceStartEnds
MikeSourceStartEnds,DBCommand,DBCommandEnum (int),Identifie la command de base de données pour syncroniser avec la base de données local
MikeSourceStartEnds,MikeSourceID,Int32,Lien à la table MikeSources représentant une source MIKE
MikeSourceStartEnds,StartDateAndTime_Local,DateTime,Date et temps du début (local)
MikeSourceStartEnds,EndDateAndTime_Local,DateTime,Date et temps de fin (local)
MikeSourceStartEnds,SourceFlowStart_m3_day,Double (min=0) (max=1000000),Début de débit de source en mètres cubes par jour
MikeSourceStartEnds,SourceFlowEnd_m3_day,Double (min=0) (max=1000000),Fin de débit de source en mètres cubes par jour
MikeSourceStartEnds,SourcePollutionStart_MPN_100ml,Int32 (min=0) (max=10000000),Début de concentration de source en nombre plus probable de colonie de coliform fécaux par 100 milli-Litres
MikeSourceStartEnds,SourcePollutionEnd_MPN_100ml,Int32 (min=0) (max=10000000),Fin de concentration de source en nombre plus probable de colonie de coliform fécaux par 100 milli-Litres
MikeSourceStartEnds,SourceTemperatureStart_C,Double (min=-10) (max=40),Début de température de source en dégré Celcius
MikeSourceStartEnds,SourceTemperatureEnd_C,Double (min=-10) (max=40),Fin de température de source en dégré Celcius
MikeSourceStartEnds,SourceSalinityStart_PSU,Double (min=0) (max=40),Début de salinité de source (PSU) (fr)
MikeSourceStartEnds,SourceSalinityEnd_PSU,Double (min=0) (max=40),Fin de salinité de source (PSU) (fr)
MikeSourceStartEnds,LastUpdateDate_UTC,DateTime,Contient la date de la dernière mise à jour en (UTC)
MikeSourceStartEnds,LastUpdateContactTVItemID,Int32,Contact TVItemID qui a fait le dernier changement
MWQMAnalysisReportParameters,,,La table MWQMAnalysisReportParameters contient des champs permettant de gérer les paramètres du rapport d'analyse.
MWQMAnalysisReportParameters,MWQMAnalysisReportParameterID,Int32 (key),Contient l'identifiant unique sur chaque ligne de la table MWQMAnalysisReportParameters
MWQMAnalysisReportParameters,DBCommand,DBCommandEnum (int),Identifie la command de base de données pour syncroniser avec la base de données local
MWQMAnalysisReportParameters,SubsectorTVItemID,Int32,Lien à la table TVItems représentant le sous-secteur
MWQMAnalysisReportParameters,AnalysisName,String (min=5) (max=250),Nom de l'analyse
MWQMAnalysisReportParameters,AnalysisReportYear,Int32 (min=1980) (max=2050),Année du raport d'analyse
MWQMAnalysisReportParameters,StartDate,DateTime,Date de départ
MWQMAnalysisReportParameters,EndDate,DateTime,Date de fin
MWQMAnalysisReportParameters,AnalysisCalculationType,AnalysisCalculationTypeEnum (int),Type de calcul d'analyse
MWQMAnalysisReportParameters,NumberOfRuns,Int32 (min=1) (max=1000),Nombre de tournée
MWQMAnalysisReportParameters,FullYear,Boolean,Toute l'année
MWQMAnalysisReportParameters,SalinityHighlightDeviationFromAverage,Double (min=1) (max=20),Écart de salinité hyghlight par rapport à la moyenne
MWQMAnalysisReportParameters,ShortRangeNumberOfDays,Int32 (min=0) (max=5),Portée courte nombre de jours
MWQMAnalysisReportParameters,MidRangeNumberOfDays,Int32 (min=2) (max=7),Portée moyenne nombre de jours
MWQMAnalysisReportParameters,DryLimit24h,Int32 (min=1) (max=100),Limit sèche 24h
MWQMAnalysisReportParameters,DryLimit48h,Int32 (min=1) (max=100),Limit sèche 48h
MWQMAnalysisReportParameters,DryLimit72h,Int32 (min=1) (max=100),Limit sèche 72h
MWQMAnalysisReportParameters,DryLimit96h,Int32 (min=1) (max=100),Limit sèche 96h
MWQMAnalysisReportParameters,WetLimit24h,Int32 (min=1) (max=100),Limit pluie 24h
MWQMAnalysisReportParameters,WetLimit48h,Int32 (min=1) (max=100),Limit pluie 48h
MWQMAnalysisReportParameters,WetLimit72h,Int32 (min=1) (max=100),Limit pluie 72h
MWQMAnalysisReportParameters,WetLimit96h,Int32 (min=1) (max=100),Limit pluie 96h
MWQMAnalysisReportParameters,RunsToOmit,String (max=250),Tournée à omettre
MWQMAnalysisReportParameters,ShowDataTypes,String (max=20),Type de donnée à montrer
MWQMAnalysisReportParameters,ExcelTVFileTVItemID,Int32,Lien à la table TVItems représentant un document Excel
MWQMAnalysisReportParameters,Command,AnalysisReportExportCommandEnum (int),Commande d'exportation du raport d'analyse
MWQMAnalysisReportParameters,LastUpdateDate_UTC,DateTime,Contient la date de la dernière mise à jour en (UTC)
MWQMAnalysisReportParameters,LastUpdateContactTVItemID,Int32,Contact TVItemID qui a fait le dernier changement
MWQMLookupMPNs,,,La table MWQMLookupMPNs contient tous les MPN possibles
MWQMLookupMPNs,MWQMLookupMPNID,Int32 (key),Contient l'identifiant unique sur chaque ligne de la table MWQMLookupMPNs
MWQMLookupMPNs,DBCommand,DBCommandEnum (int),Identifie la command de base de données pour syncroniser avec la base de données local
MWQMLookupMPNs,Tubes10,Int32 (min=0) (max=5),Nombre de tube positif pour Tube 10
MWQMLookupMPNs,Tubes1,Int32 (min=0) (max=5),Nombre de tube positif pour Tube 1
MWQMLookupMPNs,Tubes01,Int32 (min=0) (max=5),Nombre de tube positif pour Tube .1
MWQMLookupMPNs,MPN_100ml,Int32 (min=1) (max=10000),Nombre le plus probable de colonies de coliform fécaux par 100 mL
MWQMLookupMPNs,LastUpdateDate_UTC,DateTime,Contient la date de la dernière mise à jour en (UTC)
MWQMLookupMPNs,LastUpdateContactTVItemID,Int32,Contact TVItemID qui a fait le dernier changement
MWQMRuns,,,La table MWQMRuns contient des champs permettant de conserver et de gérer une analyse de la qualité de l'eau de mer.
MWQMRuns,MWQMRunID,Int32 (key),Contient l'identifiant unique sur chaque ligne de la table MWQMRuns
MWQMRuns,DBCommand,DBCommandEnum (int),Identifie la command de base de données pour syncroniser avec la base de données local
MWQMRuns,SubsectorTVItemID,Int32,Lien à la table TVItems représentant le sous-secteur
MWQMRuns,MWQMRunTVItemID,Int32,Lien à la table TVItems représentant la tournée MWQM (fr)
MWQMRuns,RunSampleType,SampleTypeEnum (int),Type d'échantillon
MWQMRuns,DateTime_Local,DateTime,Date (local)
MWQMRuns,RunNumber,Int32 (min=1) (max=1000),Numéro de la tournée
MWQMRuns,StartDateTime_Local,DateTime,Date du début
MWQMRuns,EndDateTime_Local,DateTime,Date de fin
MWQMRuns,LabReceivedDateTime_Local,DateTime,Date reçu au laboratoire
MWQMRuns,TemperatureControl1_C,Double (min=-10) (max=40),Température de control 1 en dégré Celcius
MWQMRuns,TemperatureControl2_C,Double (min=-10) (max=40),Température de control 2 en dégré Celcius
MWQMRuns,SeaStateAtStart_BeaufortScale,BeaufortScaleEnum (int),État de la mer au début (Échelle Beaufort)
MWQMRuns,SeaStateAtEnd_BeaufortScale,BeaufortScaleEnum (int),État de la mer à la fin (Échelle Beaufort)
MWQMRuns,WaterLevelAtBrook_m,Double (min=0) (max=100),Niveau d'eau au ruisseau en mètres
MWQMRuns,WaveHightAtStart_m,Double (min=0) (max=100),Hauteur des vagues au début en mètres
MWQMRuns,WaveHightAtEnd_m,Double (min=0) (max=100),Hauteur des vagues à la fin en mètres
MWQMRuns,SampleCrewInitials,String (max=20),Initiales de l'équipe de la tournée
MWQMRuns,AnalyzeMethod,AnalyzeMethodEnum (int),Méthode d'analyse
MWQMRuns,SampleMatrix,SampleMatrixEnum (int),Milieu de l'échantillon
MWQMRuns,Laboratory,LaboratoryEnum (int),Laboratoire
MWQMRuns,SampleStatus,SampleStatusEnum (int),État de l'échantillon
MWQMRuns,LabSampleApprovalContactTVItemID,Int32,Échantillon reçu au laboratoire apprové par contact TVItemID
MWQMRuns,LabAnalyzeBath1IncubationStartDateTime_Local,DateTime,Date de début du bain d'incubation 1 du laboratoire (local)
MWQMRuns,LabAnalyzeBath2IncubationStartDateTime_Local,DateTime,Date de début du bain d'incubation 2 du laboratoire (local)
MWQMRuns,LabAnalyzeBath3IncubationStartDateTime_Local,DateTime,Date de début du bain d'incubation 3 du laboratoire (local)
MWQMRuns,LabRunSampleApprovalDateTime_Local,DateTime,Date d'approbation de l'échantillon de la tournée reçu au lab (local)
MWQMRuns,Tide_Start,TideTextEnum (int),Marée de début
MWQMRuns,Tide_End,TideTextEnum (int),Marée de find
MWQMRuns,RainDay0_mm,Double (min=0) (max=300),Pluie jour 0 en millimètres
MWQMRuns,RainDay1_mm,Double (min=0) (max=300),Pluie jour 1 en millimètres
MWQMRuns,RainDay2_mm,Double (min=0) (max=300),Pluie jour 2 en millimètres
MWQMRuns,RainDay3_mm,Double (min=0) (max=300),Pluie jour 3 en millimètres
MWQMRuns,RainDay4_mm,Double (min=0) (max=300),Pluie jour 4 en millimètres
MWQMRuns,RainDay5_mm,Double (min=0) (max=300),Pluie jour 5 en millimètres
MWQMRuns,RainDay6_mm,Double (min=0) (max=300),Pluie jour 6 en millimètres
MWQMRuns,RainDay7_mm,Double (min=0) (max=300),Pluie jour 7 en millimètres
MWQMRuns,RainDay8_mm,Double (min=0) (max=300),Pluie jour 8 en millimètres
MWQMRuns,RainDay9_mm,Double (min=0) (max=300),Pluie jour 9 en millimètres
MWQMRuns,RainDay10_mm,Double (min=0) (max=300),Pluie jour 10 en millimètres
MWQMRuns,RemoveFromStat,Boolean,Enlever des statistiques
MWQMRuns,LastUpdateDate_UTC,DateTime,Contient la date de la dernière mise à jour en (UTC)
MWQMRuns,LastUpdateContactTVItemID,Int32,Contact TVItemID qui a fait le dernier changement
MWQMRunLanguages,,,The MWQMRunLanguages table contains fields for holding bilingual texts for the MWQMRuns table.
MWQMRunLanguages,MWQMRunLanguageID,Int32 (key),Contient l'identifiant unique sur chaque ligne de la table MWQMRunLanguages
MWQMRunLanguages,DBCommand,DBCommandEnum (int),Identifie la command de base de données pour syncroniser avec la base de données local
MWQMRunLanguages,MWQMRunID,Int32,Lien à la table MWQMRuns représentant la tournée MWQM (fr)
MWQMRunLanguages,Language,LanguageEnum (int),Langage de l'item
MWQMRunLanguages,RunComment,String,Commentaire de la tournée
MWQMRunLanguages,TranslationStatusRunComment,TranslationStatusEnum (int),Le statut de la traduction du commentaire de la tournée
MWQMRunLanguages,RunWeatherComment,String,Commentaire de la météo de la tournée
MWQMRunLanguages,TranslationStatusRunWeatherComment,TranslationStatusEnum (int),Le statut de la traduction du commentaire de la météo de la tournée
MWQMRunLanguages,LastUpdateDate_UTC,DateTime,Contient la date de la dernière mise à jour en (UTC)
MWQMRunLanguages,LastUpdateContactTVItemID,Int32,Contact TVItemID qui a fait le dernier changement
MWQMSamples,,,La table MWQMSamples contient des champs permettant de conserver les résultats des échantillons pour un site et une analyse de qualité de l'eau de mer.
MWQMSamples,MWQMSampleID,Int32 (key),Contient l'identifiant unique sur chaque ligne de la table MWQMSamples
MWQMSamples,DBCommand,DBCommandEnum (int),Identifie la command de base de données pour syncroniser avec la base de données local
MWQMSamples,MWQMSiteTVItemID,Int32,Lien à la table TVItems représentant le site MWQM
MWQMSamples,MWQMRunTVItemID,Int32,Lien à la table TVItems représentant la tournée MWQM
MWQMSamples,SampleDateTime_Local,DateTime,Date et temps de l'échantillon (local)
MWQMSamples,TimeText,String (max=6),Texte du temps
