Table,Field,Type,Description
ContactShortcuts,ContactID,Int32,Lien à la table Contacts avec l'identifiant unique
ContactShortcuts,ShortCutText,String (max=100),Texte de raccourci
ContactShortcuts,ShortCutAddress,String (max=200),Texte de l'address
ContactShortcuts,LastUpdateDate_UTC,DateTime,Contient la date de la dernière mise à jour en (UTC)
ContactShortcuts,LastUpdateContactTVItemID,Int32,Contact TVItemID qui a fait le dernier changement
DocTemplates,,,La table DocTemplates contient des champs pour contenir des modèles prédéfinis lors de la création de nombreux types de documents, tels que .xlsx, .docx, .csv, .txt, etc. Cette option d'exportation de données vers des documents est remplacée par des exportations de type paramètre. Cette table pourrait être supprimé à l'avenir.
DocTemplates,DocTemplateID,Int32 (key),Contient l'identifiant unique sur chaque ligne de la table DocTemplates
DocTemplates,DBCommand,DBCommandEnum (int),Identifie la command de base de données pour syncroniser avec la base de données local
DocTemplates,Language,LanguageEnum (int),Langage du document modèle
DocTemplates,TVType,TVTypeEnum (int),Type d'item pour l'arbre visuel
DocTemplates,TVFileTVItemID,Int32,Lien à la table TVFiles avec l'identifiant unique
DocTemplates,FileName,String (max=150),Nom de la filière du document modèle
DocTemplates,LastUpdateDate_UTC,DateTime,Contient la date de la dernière mise à jour en (UTC)
DocTemplates,LastUpdateContactTVItemID,Int32,Contact TVItemID qui a fait le dernier changement
DrogueRuns,,,La table DrogueRuns contient des champs pour afficher le suivi des drogues sur le Web. Il contient les noms, les numéros et la date des courses de drogue.
DrogueRuns,DrogueRunID,Int32 (key),Contient l'identifiant unique sur chaque ligne de la table DrogueRuns
DrogueRuns,DBCommand,DBCommandEnum (int),Identifie la command de base de données pour syncroniser avec la base de données local
DrogueRuns,SubsectorTVItemID,Int32,Lien à la table TVItems représentant le sous-secteur
DrogueRuns,DrogueNumber,Int32 (min=0) (max=100),Numéro de drogue
DrogueRuns,DrogueType,DrogueTypeEnum (int),Type de drogue
DrogueRuns,RunStartDateTime,DateTime,Date et temps de départ de la run drogue (local)
DrogueRuns,IsRisingTide,Boolean,Marée montante
DrogueRuns,LastUpdateDate_UTC,DateTime,Contient la date de la dernière mise à jour en (UTC)
DrogueRuns,LastUpdateContactTVItemID,Int32,Contact TVItemID qui a fait le dernier changement
DrogueRunPositions,,,La table DrogueRunPositions contient des champs pour afficher le suivi des drogues sur le Web. Il contient les coordonnées temporelles.
DrogueRunPositions,DrogueRunPositionID,Int32 (key),Contient l'identifiant unique sur chaque ligne de la table DrogueRunPositions
DrogueRunPositions,DBCommand,DBCommandEnum (int),Identifie la command de base de données pour syncroniser avec la base de données local
DrogueRunPositions,DrogueRunID,Int32,Lien à la table DrogueRuns représentant la drogue run (fr)
DrogueRunPositions,Ordinal,Int32 (min=0) (max=100000),Ordinal (fr)
DrogueRunPositions,StepLat,Double (min=-180) (max=180),Step Lat
DrogueRunPositions,StepLng,Double (min=-90) (max=90),Step Lng
DrogueRunPositions,StepDateTime_Local,DateTime,Step date and time (local) (fr)
DrogueRunPositions,CalculatedSpeed_m_s,Double (min=0) (max=10),Calculated speed (m/s) (fr)
DrogueRunPositions,CalculatedDirection_deg,Double (min=0) (max=360),Calculated direction (deg) (fr)
DrogueRunPositions,LastUpdateDate_UTC,DateTime,Contient la date de la dernière mise à jour en (UTC)
DrogueRunPositions,LastUpdateContactTVItemID,Int32,Contact TVItemID qui a fait le dernier changement
Emails,,,La table Emails contient des champs pour contenir des e-mails complets. Il est utilisé avec les contacts de la municipalité et les seconds e-mails des utilisateurs.
Emails,EmailID,Int32 (key),Contient l'identifiant unique sur chaque ligne de la table Emails
Emails,DBCommand,DBCommandEnum (int),Identifie la command de base de données pour syncroniser avec la base de données local
Emails,EmailTVItemID,Int32,Lien à la table TVItems représentant la courriel
Emails,EmailAddress,String (max=255),Adresse courriel
Emails,EmailType,EmailTypeEnum (int),Type de courriel
Emails,LastUpdateDate_UTC,DateTime,Contient la date de la dernière mise à jour en (UTC)
Emails,LastUpdateContactTVItemID,Int32,Contact TVItemID qui a fait le dernier changement
EmailDistributionLists,,,La table EmailDistributionLists contient des champs permettant d'identifier les listes de distribution d'e-mails.
EmailDistributionLists,EmailDistributionListID,Int32 (key),Contient l'identifiant unique sur chaque ligne de la table EmailDistributionLists
EmailDistributionLists,DBCommand,DBCommandEnum (int),Identifie la command de base de données pour syncroniser avec la base de données local
EmailDistributionLists,ParentTVItemID,Int32,Lien à la table TVItems représentant le TVItem du parent
EmailDistributionLists,Ordinal,Int32 (min=0) (max=1000),Ordre
EmailDistributionLists,LastUpdateDate_UTC,DateTime,Contient la date de la dernière mise à jour en (UTC)
EmailDistributionLists,LastUpdateContactTVItemID,Int32,Contact TVItemID qui a fait le dernier changement
EmailDistributionListContacts,,,La table EmailDistributionListContacts contient tous les noms de contacts pour une liste de distribution d'e-mails spécifiée.
EmailDistributionListContacts,EmailDistributionListContactID,Int32 (key),Contient l'identifiant unique sur chaque ligne de la table EmailDistributionListContacts
EmailDistributionListContacts,DBCommand,DBCommandEnum (int),Identifie la command de base de données pour syncroniser avec la base de données local
EmailDistributionListContacts,EmailDistributionListID,Int32,Lien à la table EmailDistributionList représentant la liste de distribution des courriels
EmailDistributionListContacts,IsCC,Boolean,Envoy courriel comme CC
EmailDistributionListContacts,Name,String (max=100),Nom du contact
EmailDistributionListContacts,Email,String (max=200),Courriel du contact
EmailDistributionListContacts,CMPRainfallSeasonal,Boolean,Pluie Saisonnière PGC
EmailDistributionListContacts,CMPWastewater,Boolean,Eaux usées PGC
EmailDistributionListContacts,EmergencyWeather,Boolean,Pluie Urgence
EmailDistributionListContacts,EmergencyWastewater,Boolean,Eaux Usées Urgence
EmailDistributionListContacts,ReopeningAllTypes,Boolean,Réouverture Tous Types
EmailDistributionListContacts,LastUpdateDate_UTC,DateTime,Contient la date de la dernière mise à jour en (UTC)
EmailDistributionListContacts,LastUpdateContactTVItemID,Int32,Contact TVItemID qui a fait le dernier changement
EmailDistributionListContactLanguages,,,La table EmailDistributionListContactLanguages contient des champs pour contenir les textes bilingues de la table EmailDistributionListContacts.
EmailDistributionListContactLanguages,EmailDistributionListContactLanguageID,Int32 (key),Contient l'identifiant unique sur chaque ligne de la table EmailDistributionListContactLanguages
EmailDistributionListContactLanguages,DBCommand,DBCommandEnum (int),Identifie la command de base de données pour syncroniser avec la base de données local
EmailDistributionListContactLanguages,EmailDistributionListContactID,Int32,Lien à la table EmailDistributionListContact représentant la liste de distribution des courriels contact
EmailDistributionListContactLanguages,Language,LanguageEnum (int),Langage de l'item
EmailDistributionListContactLanguages,Agency,String (min=1) (max=100),Agence
EmailDistributionListContactLanguages,TranslationStatus,TranslationStatusEnum (int),Le statut de la traduction du nom de l'agence
EmailDistributionListContactLanguages,LastUpdateDate_UTC,DateTime,Contient la date de la dernière mise à jour en (UTC)
EmailDistributionListContactLanguages,LastUpdateContactTVItemID,Int32,Contact TVItemID qui a fait le dernier changement
EmailDistributionListLanguages,,,La table EmailDistributionListLanguages contient des champs permettant de stocker des textes bilingues d'EmailDistributionLists.
EmailDistributionListLanguages,EmailDistributionListLanguageID,Int32 (key),Contient l'identifiant unique sur chaque ligne de la table EmailDistributionListLanguages
EmailDistributionListLanguages,DBCommand,DBCommandEnum (int),Identifie la command de base de données pour syncroniser avec la base de données local
EmailDistributionListLanguages,EmailDistributionListID,Int32,Lien à la table EmailDistributionList représentant la liste de distribution des courriels
EmailDistributionListLanguages,Language,LanguageEnum (int),Langage de l'item
EmailDistributionListLanguages,EmailListName,String (min=1) (max=100),Nom de la liste de courriel
EmailDistributionListLanguages,TranslationStatus,TranslationStatusEnum (int),Le statut de la traduction du nom de la région
EmailDistributionListLanguages,LastUpdateDate_UTC,DateTime,Contient la date de la dernière mise à jour en (UTC)
EmailDistributionListLanguages,LastUpdateContactTVItemID,Int32,Contact TVItemID qui a fait le dernier changement
HelpDocs,,,La table HelpDocs contient des champs pour contenir les informations d'aide utilisées dans certaines applications. Surtout le Web.
HelpDocs,HelpDocID,Int32 (key),Contient l'identifiant unique sur chaque ligne de la table HelpDocs
HelpDocs,DBCommand,DBCommandEnum (int),Identifie la command de base de données pour syncroniser avec la base de données local
HelpDocs,DocKey,String (max=100),Identifiant du document aide
HelpDocs,Language,LanguageEnum (int),Langage du document aide
HelpDocs,DocHTMLText,String (max=100000),Texte HTML du document help
HelpDocs,LastUpdateDate_UTC,DateTime,Contient la date de la dernière mise à jour en (UTC)
HelpDocs,LastUpdateContactTVItemID,Int32,Contact TVItemID qui a fait le dernier changement
HydrometricDataValues,,,La table HydrometricDataValues contient des champs permettant de conserver les valeurs de données hydrométriques pour divers sites hydrométriques du Service hydrométrique du Canada.
HydrometricDataValues,HydrometricDataValueID,Int32 (key),Contient l'identifiant unique sur chaque ligne de la table HydrometricDataValues
HydrometricDataValues,DBCommand,DBCommandEnum (int),Identifie la command de base de données pour syncroniser avec la base de données local
HydrometricDataValues,HydrometricSiteID,Int32,Lien au parent CydrometricSite à l'item de la table HydrometricSites
HydrometricDataValues,DateTime_Local,DateTime,Date et temps de l'observation. Pratiquement tous les données proviennent de site web water office
HydrometricDataValues,Keep,Boolean,Conservez les données dans la base de données. Parfois, la base de données peut obtenir des données du site Web du bureau hydrométrique en tant que données temporaires pouvant être supprimées ultérieurement.
HydrometricDataValues,StorageDataType,StorageDataTypeEnum (int),Type de données sauvegardez peut être archivés, prévisions ou observés
HydrometricDataValues,HasBeenRead,Boolean,Les données stockées ont été lues sur le site Web du bureau météorologique
HydrometricDataValues,Discharge_m3_s,Double (min=0) (max=100000),Débits en mètres cube par second
HydrometricDataValues,DischargeEntered_m3_s,Double (min=0) (max=100000),Débits entrés en mètres cube par second
HydrometricDataValues,Level_m,Double (min=0) (max=10000),Niveaux en meters
HydrometricDataValues,HourlyValues,String,Texte contenant les valeurs horaires
HydrometricDataValues,LastUpdateDate_UTC,DateTime,Contient la date de la dernière mise à jour en (UTC)
HydrometricDataValues,LastUpdateContactTVItemID,Int32,Contact TVItemID qui a fait le dernier changement
HydrometricSites,,,La table HydrometricSites contient des champs pour contenir des informations sur les sites hydrométriques du Service hydrométrique du Canada ainsi que certains sites hydrométriques provinciaux.
HydrometricSites,HydrometricSiteID,Int32 (key),Contient l'identifiant unique sur chaque ligne de la table HydrometricSites
HydrometricSites,DBCommand,DBCommandEnum (int),Identifie la command de base de données pour syncroniser avec la base de données local
HydrometricSites,HydrometricSiteTVItemID,Int32,Lien à la table TVItems avec l'identifiant unique
HydrometricSites,FedSiteNumber,String (max=7),Numéro de site fédéral
HydrometricSites,QuebecSiteNumber,String (max=7),Numéro de site du Québec
HydrometricSites,HydrometricSiteName,String (max=200),Nom du site hydrométrique
HydrometricSites,Description,String (max=200),Description du site hydrométrique
HydrometricSites,Province,String (max=4),Province (4 charactères)
HydrometricSites,Elevation_m,Double (min=0) (max=10000),Élévation du site en mètres au dessus du niveau moyen de la mer
HydrometricSites,StartDate_Local,DateTime,Date de début de monitoring
HydrometricSites,EndDate_Local,DateTime,Date de fin de monitoring
HydrometricSites,TimeOffset_hour,Double (min=-10) (max=0),Décalage horaire en heure (décimal)
HydrometricSites,DrainageArea_km2,Double (min=0) (max=1000000),Bassin versant en kilomètres carrés
HydrometricSites,IsNatural,Boolean,Régime naturel
HydrometricSites,IsActive,Boolean,Est maintenant active
HydrometricSites,Sediment,Boolean,Données sur les sédiments disponibles
HydrometricSites,RHBN,Boolean,Réseau hydrométrique de référence
HydrometricSites,RealTime,Boolean,Données en temps réel disponibles
HydrometricSites,HasDischarge,Boolean,Mesure débits
HydrometricSites,HasLevel,Boolean,Mesure niveaux
HydrometricSites,HasRatingCurve,Boolean,Courbe de tarage
HydrometricSites,LastUpdateDate_UTC,DateTime,Contient la date de la dernière mise à jour en (UTC)
HydrometricSites,LastUpdateContactTVItemID,Int32,Contact TVItemID qui a fait le dernier changement
Infrastructures,,,La table Infrastructures contient des champs pour contenir toutes les informations relatives aux infrastructures municipales. Les informations relatives à la STEP et au LS sont stockées dans la même table.
Infrastructures,InfrastructureID,Int32 (key),Contient l'identifiant unique sur chaque ligne de la table Infrastructures
Infrastructures,DBCommand,DBCommandEnum (int),Identifie la command de base de données pour syncroniser avec la base de données local
Infrastructures,InfrastructureTVItemID,Int32,Lien à la table TVItems avec l'identifiant unique
Infrastructures,PrismID,Int32 (min=0) (max=100000),Lien à la BD Prism QC avec l'identifiant unique
Infrastructures,TPID,Int32 (min=0) (max=100000),Identifiant unique de usine de traitement des eaux usées de la vieille base de données
Infrastructures,LSID,Int32 (min=0) (max=100000),Identifiant unique de poste de pompage de la vieille base de données
Infrastructures,SiteID,Int32 (min=0) (max=100000),Identifiant unique du site de la vieille base de données
Infrastructures,Site,Int32 (min=0) (max=100000),Identifiant unique du site de la vieille base de données
Infrastructures,InfrastructureCategory,String (min=1) (max=1),Catégory --- lettre utilisé précédement pour identifier la priorité des évaluations de systèmes de traitement des eaux
Infrastructures,InfrastructureType,InfrastructureTypeEnum (int),Type d'infrastructure
Infrastructures,FacilityType,FacilityTypeEnum (int),Type de facilité --- Lagune, Usine
Infrastructures,HasBackupPower,Boolean,A une alimentation de secours
Infrastructures,IsMechanicallyAerated,Boolean,Est mécaniquement aéré
Infrastructures,NumberOfCells,Int32 (min=0) (max=10),Nombre de cellules
Infrastructures,NumberOfAeratedCells,Int32 (min=0) (max=10),Nombre de cellules aérées
Infrastructures,AerationType,AerationTypeEnum (int),Type d'aération --- Diffuseur, Surface
Infrastructures,PreliminaryTreatmentType,PreliminaryTreatmentTypeEnum (int),Type de traintement préliminaire --- Bar screen, Grinder (fr)
Infrastructures,PrimaryTreatmentType,PrimaryTreatmentTypeEnum (int),Type de traitement primaire --- Sedimentation, Chemical Coagulation, Filtration (fr)
Infrastructures,SecondaryTreatmentType,SecondaryTreatmentTypeEnum (int),Type de traitement secondaire --- RotatingBiologicalContactor, TricklingFilters, SequencingBatchReator, OxidationDitch (fr)
Infrastructures,TertiaryTreatmentType,TertiaryTreatmentTypeEnum (int),Type de traitement tertiaire --- Adsorption, Flocculation, Membrane Filtration, Ion Exchange, Reverse Osmosis, Biological Nutrient Removal (fr)
Infrastructures,TreatmentType,TreatmentTypeEnum (int),Type de traitement --- ActivatedSludge, Activated Sludge With Biofilter, Lagoon No Aeration1 Cell, Lagoon No Aeration 2 Cell, Lagoon No Aeration 3 Cell, Lagoon No Aeration 4 Cell, Lagoon No Aeration 5 Cell, Lagoon With Aeration 1 Cell, LagoonWith Aeration 2 Cell, LagoonWith Aeration 3 Cell, LagoonWith Aeration 4 Cell, LagoonWith Aeration 5 Cell, LagoonWith Aeration 6 Cell, Stabalizing Pond Only, Oxidation Ditch Only, Circulating Fluidized Bed, Trickling Filter, Recirculating Sand Filter, Trash Rack Rake Only, Septic Tank, Secondary, Tertiary, Volume Fermenter, Bio Film Reactor, Bio Green, Bio Disks, Chemical Primary, Chromoglass, Primary, Sequencing Batch Reactor, Peat System, Physicochimique, Rotating Biological Contactor (fr)
Infrastructures,DisinfectionType,DisinfectionTypeEnum (int),Type de désinfection --- UV, Chlorination No Dechlorination, Chlorination With Dechlorination, UV Seasonal, Chlorination No Dechlorination Seasonal, Chlorination With Dechlorination Seasonal (fr)
Infrastructures,CollectionSystemType,CollectionSystemTypeEnum (int),Type de système de collection --- Completely Separated, Completely Combined, Combined 90 Separated 10, Combined 80 Separated 20, Combined 70 Separated 30, Combined 60 Separated 40, Combined 50 Separated 50, Combined 40 Separated 60, Combined 30 Separated 70, Combined 20 Separated 80, Combined 10 Separated 90 (fr)
Infrastructures,AlarmSystemType,AlarmSystemTypeEnum (int),Type de système d'alarme --- SCADA, None, Only Visual Light,SCADA And Light, Pager And Light (fr)
Infrastructures,DesignFlow_m3_day,Double (min=0) (max=1000000),Débit de design en mètres cube par jour
Infrastructures,AverageFlow_m3_day,Double (min=0) (max=1000000),Débit moyen en mètres cube par jour
Infrastructures,PeakFlow_m3_day,Double (min=0) (max=1000000),Débit maximum en mètres cube par jour
Infrastructures,PopServed,Int32 (min=0) (max=1000000),Population déservi
Infrastructures,CanOverflow,Boolean,Peut déverser
Infrastructures,ValveType,ValveTypeEnum (int),Type de vanne --- Manually, Automatically (fr)
Infrastructures,PercFlowOfTotal,Double (min=0) (max=100),Pourcentage du débit total
Infrastructures,TimeOffset_hour,Double (min=-10) (max=0),Décalage horaire en heure (décimal)
Infrastructures,TempCatchAllRemoveLater,String,Temporaire collection d'information a être effacé plus tard
Infrastructures,AverageDepth_m,Double (min=0) (max=1000),Profondeur moyenne en mètres
Infrastructures,NumberOfPorts,Int32 (min=1) (max=1000),Nombre d'embouchure
Infrastructures,PortDiameter_m,Double (min=0) (max=10),Diamètre des embouchures en mètres
Infrastructures,PortSpacing_m,Double (min=0) (max=10000),Distance des embouchures en mètres
Infrastructures,PortElevation_m,Double (min=0) (max=1000),Élévation des embouchures en mètres
Infrastructures,VerticalAngle_deg,Double (min=-90) (max=90),Angle vertical en dégrés
Infrastructures,HorizontalAngle_deg,Double (min=-180) (max=180),Angle horizontal en dégrés
Infrastructures,DecayRate_per_day,Double (min=0) (max=100),Taux de décroissance par jour
Infrastructures,NearFieldVelocity_m_s,Double (min=0) (max=10),Vitesse en champ rapproché en mètres par second
Infrastructures,FarFieldVelocity_m_s,Double (min=0) (max=10),Vitesse en champ éloigné en mètres par second
Infrastructures,ReceivingWaterSalinity_PSU,Double (min=0) (max=40),Salinité dans le milieu récepteur en PSU
Infrastructures,ReceivingWaterTemperature_C,Double (min=-10) (max=40),Température dans le milieu récepteur en dégrés Celcius
Infrastructures,ReceivingWater_MPN_per_100ml,Int32 (min=0) (max=10000000),Concentration dans le milieu récepteur en nombre plus probable par 100 mL
Infrastructures,DistanceFromShore_m,Double (min=0) (max=1000),Distance par rapport à la rive en mètres
Infrastructures,SeeOtherMunicipalityTVItemID,Int32,Voir autre infrastructure
Infrastructures,CivicAddressTVItemID,Int32,Lien à la table TVItems avec l'identifiant unique
Infrastructures,LastUpdateDate_UTC,DateTime,Contient la date de la dernière mise à jour en (UTC)
Infrastructures,LastUpdateContactTVItemID,Int32,Contact TVItemID qui a fait le dernier changement
InfrastructureLanguages,,,La table InfrastructureLanguages contient des champs permettant de stocker des textes bilingues pour la table d'infrastructure.
InfrastructureLanguages,InfrastructureLanguageID,Int32 (key),Contient l'identifiant unique sur chaque ligne de la table InfrastructureLanguages
InfrastructureLanguages,DBCommand,DBCommandEnum (int),Identifie la command de base de données pour syncroniser avec la base de données local
InfrastructureLanguages,InfrastructureID,Int32,Lien à la table Infrastructure représentant l'infrastructure
InfrastructureLanguages,Language,LanguageEnum (int),Langage de l'item
InfrastructureLanguages,Comment,String,Commentaire
InfrastructureLanguages,TranslationStatus,TranslationStatusEnum (int),Le statut de la traduction du commentaire
InfrastructureLanguages,LastUpdateDate_UTC,DateTime,Contient la date de la dernière mise à jour en (UTC)
InfrastructureLanguages,LastUpdateContactTVItemID,Int32,Contact TVItemID qui a fait le dernier changement
LabSheets,,,La table LabSheets contient des champs pour stocker et gérer les feuilles de laboratoire.
LabSheets,LabSheetID,Int32 (key),Contient l'identifiant unique sur chaque ligne de la table LabSheets
LabSheets,DBCommand,DBCommandEnum (int),Identifie la command de base de données pour syncroniser avec la base de données local
LabSheets,OtherServerLabSheetID,Int32 (min=1),ID de la feuille de laboratoire de l'autre server
LabSheets,SamplingPlanID,Int32,Lien à la table SamplingPlan représentant le plan d'échantillonnage
LabSheets,SamplingPlanName,String (min=1) (max=250),Nom du plan d'échantillonnage
LabSheets,Year,Int32 (min=1980),Année de la tournée
LabSheets,Month,Int32 (min=1) (max=12),Mois de la tournée
LabSheets,Day,Int32 (min=1) (max=31),Jour de la tournée
LabSheets,RunNumber,Int32 (min=1) (max=100),Numéro de la tournée
LabSheets,SubsectorTVItemID,Int32,Lien à la table TVItems avec l'identifiant unique
LabSheets,MWQMRunTVItemID,Int32,Lien à la table TVItems avec l'identifiant unique
LabSheets,SamplingPlanType,SamplingPlanTypeEnum (int),Type de plan d'échantillonnage
LabSheets,SampleType,SampleTypeEnum (int),Type d'échantillonnage
LabSheets,LabSheetType,LabSheetTypeEnum (int),Type de feuille de laboratoire
LabSheets,LabSheetStatus,LabSheetStatusEnum (int),État de la feuille de laboratoire
LabSheets,FileName,String (min=1) (max=250),Nom de la filière
LabSheets,FileLastModifiedDate_Local,DateTime,Date du dernier changement de la filière (local)
LabSheets,FileContent,String,Contenu de la filière
LabSheets,AcceptedOrRejectedByContactTVItemID,Int32,Accepté ou rejeté par contact TVItemID
LabSheets,AcceptedOrRejectedDateTime,DateTime,Date de l'acceptation ou rejet (local)
LabSheets,RejectReason,String (max=250),Raison du rejet
LabSheets,LastUpdateDate_UTC,DateTime,Contient la date de la dernière mise à jour en (UTC)
LabSheets,LastUpdateContactTVItemID,Int32,Contact TVItemID qui a fait le dernier changement
LabSheetDetails,,,La table LabSheetDetails contient des champs pour contenir les informations relatives aux détails de la feuille de laboratoire.
LabSheetDetails,LabSheetDetailID,Int32 (key),Contient l'identifiant unique sur chaque ligne de la table LabSheetDetails
LabSheetDetails,DBCommand,DBCommandEnum (int),Identifie la command de base de données pour syncroniser avec la base de données local
LabSheetDetails,LabSheetID,Int32,Lien à la table LabSheets représentant la feuille de laboratoire
LabSheetDetails,SamplingPlanID,Int32,Lien à la table SamplingPlan représentant la plan d'échantillonnage
LabSheetDetails,SubsectorTVItemID,Int32,Lien à la table TVItem représentant la sous-secteur
LabSheetDetails,Version,Int32 (min=1) (max=5),Version du document (feuille de laboratoire)
LabSheetDetails,RunDate,DateTime,Date de la tournée
LabSheetDetails,Tides,String (min=1) (max=7),ID des site de marées
LabSheetDetails,SampleCrewInitials,String (max=20),Initiales des contacts faisant l'échantillonnage
LabSheetDetails,WaterBathCount,Int32 (min=1) (max=3),Nombre de bain d'eau
LabSheetDetails,IncubationBath1StartTime,DateTime,Temps de départ bain d'incubation 1
LabSheetDetails,IncubationBath2StartTime,DateTime,Temps de départ bain d'incubation 2
LabSheetDetails,IncubationBath3StartTime,DateTime,Temps de départ bain d'incubation 3
LabSheetDetails,IncubationBath1EndTime,DateTime,Temps de fin bain d'incubation 1
LabSheetDetails,IncubationBath2EndTime,DateTime,Temps de fin bain d'incubation 2
LabSheetDetails,IncubationBath3EndTime,DateTime,Temps de fin bain d'incubation 3
LabSheetDetails,IncubationBath1TimeCalculated_minutes,Int32 (min=0) (max=10000),Temps calculé de bain d'incubation 1 en minutes
LabSheetDetails,IncubationBath2TimeCalculated_minutes,Int32 (min=0) (max=10000),Temps calculé de bain d'incubation 2 en minutes
LabSheetDetails,IncubationBath3TimeCalculated_minutes,Int32 (min=0) (max=10000),Temps calculé de bain d'incubation 3 en minutes
LabSheetDetails,WaterBath1,String (max=10),Bain d'eau 1
LabSheetDetails,WaterBath2,String (max=10),Bain d'eau 2
LabSheetDetails,WaterBath3,String (max=10),Bain d'eau 3
LabSheetDetails,TCField1,Double (min=-10) (max=40),Température de control 1
LabSheetDetails,TCLab1,Double (min=-10) (max=40),Température de control au laboratoire 1
LabSheetDetails,TCField2,Double (min=-10) (max=40),Température de control 2
LabSheetDetails,TCLab2,Double (min=-10) (max=40),Température de control au laboratoire 2
